Post,ReTruths,Nothing,Likes,Nothing,Date and Time,Date and Time
"Without the U.S.A., NATO IS A PAPER TIGER! They didn’t want to join the fight to stop a Nuclear Powered Iran. Now that fight is Militarily WON, with very little danger for them, they complain about the high oil prices they are forced to pay, but don’t want to help open the Strait of Hormuz, a simple military maneuver that is the single reason for the high oil prices. So easy for them to do, with so little risk. COWARDS, and we will REMEMBER! President DONALD J. TRUMP",12.1k,ReTruths,47.8k,Likes,"Mar 20, 2026, 1:43 PM",20/03/2026 13:43
"We are getting very close to meeting our objectives as we consider winding down our great Military efforts in the Middle East with respect to the Terrorist Regime of Iran: (1) Completely degrading Iranian Missile Capability, Launchers, and everything else pertaining to them. (2) Destroying Iran’s Defense Industrial Base. (3) Eliminating their Navy and Air Force, including Anti Aircraft Weaponry. (4) Never allowing Iran to get even close to Nuclear Capability, and always being in a position where the U.S.A. can quickly and powerfully react to such a situation, should it take place. (5) Protecting, at the highest level, our Middle Eastern Allies, including Israel, Saudi Arabia, Qatar, the United Arab Emirates, Bahrain, Kuwait, and others. The Hormuz Strait will have to be guarded and policed, as necessary, by other Nations who use it — The United States does not! If asked, we will help these Countries in their Hormuz efforts, but it shouldn’t be necessary once Iran’s threat is eradicated. Importantly, it will be an easy Military Operation for them. Thank you for your attention to this matter! President DONALD J. TRUMP",13k,ReTruths,55.9k,Likes,"Mar 20, 2026, 9:13 PM",20/03/2026 21:13
"The United States has blown Iran off of the map, and yet their lightweight analyst, David Sanger, says that I haven’t met my own goals. Yes I have, and weeks ahead of schedule! Their leadership is gone, their navy and air force are dead, they have absolutely no defense, and they want to make a deal. I don’t! We are weeks ahead of schedule. Just like their incompetent Election coverage of me, The Failing New York Times always gets it wrong! President DJT",7.82k,ReTruths,33.7k,Likes,"Mar 21, 2026, 10:37 PM",21/03/2026 22:37
"If Iran doesn’t FULLY OPEN, WITHOUT THREAT, the Strait of Hormuz, within 48 HOURS from this exact point in time, the United States of America will hit and obliterate their various POWER PLANTS, STARTING WITH THE BIGGEST ONE FIRST! Thank you for your attention to this matter. President DONALD J. TRUMP",10.3k,ReTruths,40.1k,Likes,"Mar 21, 2026, 11:44 PM",21/03/2026 23:44
"I AM PLEASED TO REPORT THAT THE UNITED STATES OF AMERICA, AND THE COUNTRY OF IRAN, HAVE HAD, OVER THE LAST TWO DAYS, VERY GOOD AND PRODUCTIVE CONVERSATIONS REGARDING A COMPLETE AND TOTAL RESOLUTION OF OUR HOSTILITIES IN THE MIDDLE EAST. BASED ON THE TENOR AND TONE OF THESE IN DEPTH, DETAILED, AND CONSTRUCTIVE CONVERSATIONS, WHICH WILL CONTINUE THROUGHOUT THE WEEK, I HAVE INSTRUCTED THE DEPARTMENT OF WAR TO POSTPONE ANY AND ALL MILITARY STRIKES AGAINST IRANIAN POWER PLANTS AND ENERGY INFRASTRUCTURE FOR A FIVE DAY PERIOD, SUBJECT TO THE SUCCESS OF THE ONGOING MEETINGS AND DISCUSSIONS. THANK YOU FOR YOUR ATTENTION TO THIS MATTER! PRESIDENT DONALD J. TRUMP",10.9k,ReTruths,46.1k,Likes,"Mar 23, 2026, 11:23 AM",23/03/2026 11:23
"Iran’s flex of long-range ballistic missiles vindicates Trump, may change European calculus: justthenews.com/government/sec. Iran’s attempted intermediate-range ballistic missile strike at nearly 2,500 miles shows the regime’s capability to threaten Europe, a national security expert says.",4.89k,ReTruths,17.3k,Likes,"Mar 25, 2026, 3:45 AM",25/03/2026 03:45
"NATO NATIONS HAVE DONE ABSOLUTELY NOTHING TO HELP WITH THE LUNATIC NATION, NOW MILITARILY DECIMATED, OF IRAN. THE U.S.A. NEEDS NOTHING FROM NATO, BUT “NEVER FORGET” THIS VERY IMPORTANT POINT IN TIME! President DONALD J. TRUMP",5.96k,ReTruths,22.4k,Likes,"Mar 26, 2026, 10:16 AM",26/03/2026 10:16
"The Iranian negotiators are very different and “strange.” They are “begging” us to make a deal, which they should be doing since they have been militarily obliterated, with zero chance of a comeback, and yet they publicly state that they are only “looking at our proposal.” WRONG!!! They better get serious soon, before it is too late, because once that happens, there is NO TURNING BACK, and it won’t be pretty! President DJT",8.07k,ReTruths,34.9k,Likes,"Mar 26, 2026, 10:39 AM",26/03/2026 10:39
"As per Iranian Government request, please let this statement serve to represent that I am pausing the period of Energy Plant destruction by 10 Days to Monday, April 6, 2026, at 8 P.M., Eastern Time. Talks are ongoing and, despite erroneous statements to the contrary by the Fake News Media, and others, they are going very well. Thank you for your attention to this matter! President DONALD J. TRUMP",9.77k,ReTruths,45.2k,Likes,"Mar 26, 2026, 8:11 PM",26/03/2026 20:11
"Big day in Iran. Many long sought after targets have been taken out and destroyed by our GREAT MILITARY, the finest and most lethal in the World. God bless you all! President DJT",9.27k,ReTruths,49.2k,Likes,"Mar 30, 2026, 3:29 AM",30/03/2026 03:29
"The United States of America is in serious discussions with A NEW, AND MORE REASONABLE, REGIME to end our Military Operations in Iran. Great progress has been made but, if for any reason a deal is not shortly reached, which it probably will be, and if the Hormuz Strait is not immediately “Open for Business,” we will conclude our lovely “stay” in Iran by blowing up and completely obliterating all of their Electric Generating Plants, Oil Wells and Kharg Island (and possibly all desalinization plants!), which we have purposefully not yet “touched.” This will be in retribution for our many soldiers, and others, that Iran has butchered and killed over the old Regime’s 47 year “Reign of Terror.” Thank you for your attention to this matter. President DONALD J. TRUMP",4.09k,ReTruths,15.5k,Likes,"Mar 30, 2026, 12:26 PM",30/03/2026 12:26
"All of those countries that can’t get jet fuel because of the Strait of Hormuz, like the United Kingdom, which refused to get involved in the decapitation of Iran, I have a suggestion for you: Number 1, buy from the U.S., we have plenty, and Number 2, build up some delayed courage, go to the Strait, and just TAKE IT. You’ll have to start learning how to fight for yourself, the U.S.A. won’t be there to help you anymore, just like you weren’t there for us. Iran has been, essentially, decimated. The hard part is done. Go get your own oil! President DJT",14.5k,ReTruths,57.6k,Likes,"Mar 31, 2026, 12:11 PM",31/03/2026 12:11
"The Country of France wouldn’t let planes headed to Israel, loaded up with military supplies, fly over French territory. France has been VERY UNHELPFUL with respect to the “Butcher of Iran,” who has been successfully eliminated! The U.S.A. will REMEMBER!!! President DJT",8.24k,ReTruths,32.8k,Likes,"Mar 31, 2026, 12:19 PM",31/03/2026 12:19
"Iran’s New Regime President, much less Radicalized and far more intelligent than his predecessors, has just asked the United States of America for a CEASEFIRE! We will consider when Hormuz Strait is open, free, and clear. Until then, we are blasting Iran into oblivion or, as they say, back to the Stone Ages!!! President DJT",11k,ReTruths,50k,Likes,"Apr 01, 2026, 1:44 PM",01/04/2026 13:44
"The biggest bridge in Iran comes tumbling down, never to be used again — Much more to follow! IT IS TIME FOR IRAN TO MAKE A DEAL BEFORE IT IS TOO LATE, AND THERE IS NOTHING LEFT OF WHAT STILL COULD BECOME A GREAT COUNTRY! President DONALD J. TRUMP",6.42k,ReTruths,26.3k,Likes,"Apr 02, 2026, 5:37 PM",02/04/2026 17:37
"Our Military, the greatest and most powerful (by far!) anywhere in the World, hasn’t even started destroying what’s left in Iran. Bridges next, then Electric Power Plants! New Regime leadership knows what has to be done, and has to be done, FAST! President DONALD J.TRUMP",7.53k,ReTruths,35k,Likes,"Apr 03, 2026, 3:41 AM",03/04/2026 03:41
"With a little more time, we can easily OPEN THE HORMUZ STRAIT, TAKE THE OIL, & MAKE A FORTUNE. IT WOULD BE A “GUSHER” FOR THE WORLD??? President DONALD J. TRUMP",8.33k,ReTruths,39.3k,Likes,"Apr 03, 2026, 1:22 PM",03/04/2026 13:22
"KEEP THE OIL, ANYONE?",6.73k,ReTruths,34.8k,Likes,"Apr 03, 2026, 8:20 PM",03/04/2026 20:20
Remember when I gave Iran ten days to MAKE A DEAL or OPEN UP THE HORMUZ STRAIT. Time is running out - 48 hours before all Hell will reign down on them. Glory be to GOD! President DONALD J. TRUMP,10.9k,ReTruths,48.4k,Likes,"Apr 04, 2026, 3:05 PM",04/04/2026 15:05
"Many of Iran’s Military Leaders, who have led them poorly and unwisely, are terminated, along with much else, with this massive strike in Tehran! President DONALD J. TRUMP",8.88k,ReTruths,40.8k,Likes,"Apr 04, 2026, 9:37 PM",04/04/2026 21:37
"WE GOT HIM! My fellow Americans, over the past several hours, the United States Military pulled off one of the most daring Search and Rescue Operations in U.S. History, for one of our incredible Crew Member Officers, who also happens to be a highly respected Colonel, and who I am thrilled to let you know is now SAFE and SOUND! This brave Warrior was behind enemy lines in the treacherous mountains of Iran, being hunted down by our enemies, who were getting closer and closer by the hour, but was never truly alone because his Commander in Chief, Secretary of War, Chairman of the Joint Chiefs of Staff, and fellow Warfighters were monitoring his location 24 hours a day, and diligently planning for his rescue. At my direction, the U.S. Military sent dozens of aircraft, armed with the most lethal weapons in the World, to retrieve him. He sustained injuries, but he will be just fine. This miraculous Search and Rescue Operation comes in addition to a successful rescue of another brave Pilot, yesterday, which we did not confirm, because we did not want to jeopardize our second rescue operation. This is the first time in military memory that two U.S. Pilots have been rescued, separately, deep in Enemy Territory. WE WILL NEVER LEAVE AN AMERICAN WARFIGHTER BEHIND! The fact that we were able to pull off both of these operations, without a SINGLE American killed, or even wounded, just proves once again, that we have achieved overwhelming Air Dominance and Superiority over the Iranian skies. This is a moment that ALL Americans, Republican, Democrat, and everyone else, should be proud of and united around. We truly have the best, most professional, and lethal Military in the History of the World. GOD BLESS AMERICA, GOD BLESS OUR TROOPS, AND HAPPY EASTER TO ALL!",19.9k,ReTruths,85.3k,Likes,"Apr 05, 2026, 5:08 AM",05/04/2026 05:08
"We have rescued the seriously wounded, and really brave, F-15 Crew Member/Officer, from deep inside the mountains of Iran. The Iranian Military was looking hard, in big numbers, and getting close. He is a highly respected Colonel. This type of raid is seldom attempted because of the danger to “man and equipment.” It just doesn’t happen! The second raid came after the first one, where we rescued the pilot in broad daylight, also unusual, spending seven hours over Iran. An AMAZING show of bravery and talent by all! I will be having a News Conference, with the Military, at the Oval Office, on Monday, at 1:00 P.M. God Bless our great MILITARY WARRIORS! President DONALD J. TRUMP",11.9k,ReTruths,57k,Likes,"Apr 05, 2026, 12:52 PM",05/04/2026 12:52
"Tuesday will be Power Plant Day, and Bridge Day, all wrapped up in one, in Iran. There will be nothing like it!!! Open the Fuckin’ Strait, you crazy bastards, or you’ll be living in Hell - JUST WATCH! Praise be to Allah. President DONALD J. TRUMP",19.2k,ReTruths,83k,Likes,"Apr 05, 2026, 1:03 PM",05/04/2026 13:03
"Tuesday, 8:00 P.M. Eastern Time!",6.65k,ReTruths,30.9k,Likes,"Apr 05, 2026, 5:38 PM",05/04/2026 17:38
"A whole civilization will die tonight, never to be brought back again. I don’t want that to happen, but it probably will. However, now that we have Complete and Total Regime Change, where different, smarter, and less radicalized minds prevail, maybe something revolutionarily wonderful can happen, WHO KNOWS? We will find out tonight, one of the most important moments in the long and complex history of the World. 47 years of extortion, corruption, and death, will finally end. God Bless the Great People of Iran!",1.06k,ReTruths,3.87k,Likes,"Apr 07, 2026, 1:06 PM",07/04/2026 13:06
"Based on conversations with Prime Minister Shehbaz Sharif and Field Marshal Asim Munir, of Pakistan, and wherein they requested that I hold off the destructive force being sent tonight to Iran, and subject to the Islamic Republic of Iran agreeing to the COMPLETE, IMMEDIATE, and SAFE OPENING of the Strait of Hormuz, I agree to suspend the bombing and attack of Iran for a period of two weeks. This will be a double sided CEASEFIRE! The reason for doing so is that we have already met and exceeded all Military objectives, and are very far along with a definitive Agreement concerning Longterm PEACE with Iran, and PEACE in the Middle East. We received a 10 point proposal from Iran, and believe it is a workable basis on which to negotiate. Almost all of the various points of past contention have been agreed to between the United States and Iran, but a two week period will allow the Agreement to be finalized and consummated. On behalf of the United States of America, as President, and also representing the Countries of the Middle East, it is an Honor to have this Longterm problem close to resolution. Thank you for your attention to this matter! President DONALD J. TRUMP",15.2k,ReTruths,65.6k,Likes,"Apr 07, 2026, 11:32 PM",07/04/2026 23:32
"The alleged Statement put out by CNN World News is a FRAUD, as CNN well knows. The false Statement was linked to a Fake News site (from Nigeria) and, of course, immediately picked up by CNN, and blared out as a “legitimate” headline. The Official Statement by Iran was just released, and posted on TRUTH, below. Authorities are looking to determine whether or not a crime was committed on the issuance of the Fake CNN World Statement, or was it a sick rogue player? CNN is being ordered to immediately withdraw this Statement with full apologies for their, as usual, terrible “reporting.” Results of the investigation will be announced in the near future. President DONALD J. TRUMP",9.06k,ReTruths,34.3k,Likes,"Apr 08, 2026, 1:01 AM",08/04/2026 01:01
"No one can believe that Fake News CNN put out a knowingly false and dangerous statement pretending it came from the upper levels of the Iranian Government. It didn’t! It was totally made up and posted, as a headline, for purpose of, perhaps, inflaming a very delicate situation. It was a new, trouble making site from Nigeria, and CNN just got caught cheating - A very dangerous thing to do!",6.85k,ReTruths,26.3k,Likes,"Apr 08, 2026, 4:39 AM",08/04/2026 04:39
"A big day for World Peace! Iran wants it to happen, they’ve had enough! Likewise, so has everyone else! The United States of America will be helping with the traffic buildup in the Strait of Hormuz. There will be lots of positive action! Big money will be made. Iran can start the reconstruction process. We’ll be loading up with supplies of all kinds, and just “hangin’ around” in order to make sure that everything goes well. I feel confident that it will. Just like we are experiencing in the U.S., this could be the Golden Age of the Middle East!!! President DONALD J. TRUMP",8.92k,ReTruths,38.3k,Likes,"Apr 08, 2026, 5:01 AM",08/04/2026 05:01
"The United States will work closely with Iran, which we have determined has gone through what will be a very productive Regime Change! There will be no enrichment of Uranium, and the United States will, working with Iran, dig up and remove all of the deeply buried (B-2 Bombers) Nuclear “Dust.” It is now, and has been, under very exacting Satellite Surveillance (Space Force!). Nothing has been touched from the date of attack. We are, and will be, talking Tariff and Sanctions relief with Iran. Many of the 15 points have already been been agreed to. Thank you for your attention to this matter. President DONALD J. TRUMP",7.59k,ReTruths,32.6k,Likes,"Apr 08, 2026, 12:22 PM",08/04/2026 12:22
"A Country supplying Military Weapons to Iran will be immediately tariffed, on any and all goods sold to the United States of America, 50%, effective immediately. There will be no exclusions or exemptions! President DJT",9.23k,ReTruths,41k,Likes,"Apr 08, 2026, 12:30 PM",08/04/2026 12:30
"Numerous Agreements, Lists, and Letters are being sent out by people that have absolutely nothing to do with the U.S.A. / Iran Negotiation, in many cases, they are total Fraudsters, Charlatans, and WORSE. They will be rapidly exposed after our Federal Investigation is completed. There is only one group of meaningful “POINTS” that are acceptable to the United States, and we will be discussing them behind closed doors during these Negotiations. These are the POINTS that are the basis on which we agreed to a CEASEFIRE. It is something that is reasonable, and can easily be dispensed with. It’s very much like Fake News CNN last night, headlining a “source” that had no power or authority to write a Letter claiming great authority. President DONALD J. TRUMP",10.7k,ReTruths,44.9k,Likes,"Apr 08, 2026, 5:04 PM",08/04/2026 17:04
The Failing New York Times and Fake News CNN each reported a totally FAKE TEN POINT PLAN on the Iran negotiations which was meant to discredit the people involved in the peace process. All ten points were a made up HOAX - EVIL LOSERS!!! MAKE AMERICA GREAT AGAIN,5.85k,ReTruths,22.6k,Likes,"Apr 09, 2026, 3:56 AM",09/04/2026 03:56
"All U.S. Ships, Aircraft, and Military Personnel, with additional Ammunition, Weaponry, and anything else that is appropriate and necessary for the lethal prosecution and destruction of an already substantially degraded Enemy, will remain in place in, and around, Iran, until such time as the REAL AGREEMENT reached is fully complied with. If for any reason it is not, which is highly unlikely, then the “Shootin’ Starts,” bigger, and better, and stronger than anyone has ever seen before. It was agreed, a long time ago, and despite all of the fake rhetoric to the contrary - NO NUCLEAR WEAPONS and, the Strait of Hormuz WILL BE OPEN & SAFE. In the meantime our great Military is Loading Up and Resting, looking forward, actually, to its next Conquest. AMERICA IS BACK!",6.96k,ReTruths,28.4k,Likes,"Apr 09, 2026, 4:46 AM",09/04/2026 04:46
"None of these people, including our own, very disappointing, NATO, understood anything unless they have pressure placed upon them!!!",1.48k,ReTruths,6.58k,Likes,"Apr 09, 2026, 1:40 PM",09/04/2026 13:40
"I know why Tucker Carlson, Megyn Kelly, Candace Owens, and Alex Jones have all been fighting me for years, especially by the fact that they think it is wonderful for Iran, the Number One State Sponsor of Terror, to have a Nuclear Weapon — Because they have one thing in common, Low IQs. They’re stupid people, they know it, their families know it, and everyone else knows it, too! Look at their past, look at their record. They don’t have what it takes, and they never did! They’ve all been thrown off Television, lost their Shows, and aren’t even invited on TV because nobody cares about them, they’re NUT JOBS, TROUBLEMAKERS, and will say anything necessary for some “free” and cheap publicity. Now they think they get some “clicks” because they have Third Rate Podcasts, but nobody’s talking about them, and their views are the opposite of MAGA — Or I wouldn’t have won the Presidential Election in a LANDSLIDE. MAGA agrees with me, and just gave CNN a 100% Approval Rating of “TRUMP,” not Hand Flailing Fools like Tucker Carlson, who couldn’t even finish College, he was a broken man when he got fired from Fox, and he’s never been the same — Perhaps he should see a good psychiatrist! Or Megyn Kelly, who nastily asked me the now famous, “Only Rosie O’Donnell,” question, or “Crazy” Candace Owens, who accuses the Highly Respected First Lady of France of being a man, when she is not, and will hopefully win lots of money in the ongoing lawsuit. Actually, to me, the First Lady of France is a far more beautiful woman than Candace, in fact, it’s not even close! Or Bankrupt Alex Jones, who says some of the dumbest things, and lost his entire fortune, as he should have, for his horrendous attack on the families of the Sandy Hook shooting victims, ridiculously claiming it was a hoax. These so-called “pundits” are LOSERS, and they always will be! Now Fake News CNN, The Failing New York Times, and all of the other Radical Left “News” Organizations, are “hailing” them, and giving them “positive” press for the first time in their lives. They’re not “MAGA,” they’re losers, just trying to latch on to MAGA. As President, I could get them on my side anytime I want to, but when they call, I don’t return their calls because I’m too busy on World and Country Affairs and, after a few times, they go “nasty,” just like Marjorie “Traitor” Brown, but I no longer care about that stuff, I only care about doing right for our Country. MAGA is about WINNING and STRENGTH in not allowing Iran to have Nuclear Weapons. MAGA is about MAKING AMERICA GREAT AGAIN, and these people have no idea how to do that, BUT I DO, because THE UNITED STATES IS NOW THE “HOTTEST” COUNTRY ANYWHERE IN THE WORLD! President DONALD J. TRUMP",15.3k,ReTruths,60.9k,Likes,"Apr 09, 2026, 9:28 PM",09/04/2026 21:28
"There are reports that Iran is charging fees to tankers going through the Hormuz Strait — They better not be and, if they are, they better stop now! President DONALD J. TRUMP",6.52k,ReTruths,29.8k,Likes,"Apr 09, 2026, 10:08 PM",09/04/2026 22:08
"The Wall Street Journal, one of the worst and most inaccurate “Editorial Boards” in the World, stated that I “declared premature victory in Iran.” Actually, it is a Victory, and there’s nothing “premature” about it! Because of me, IRAN WILL NEVER HAVE A NUCLEAR WEAPON and, very quickly, you’ll see Oil start flowing, with or without the help of Iran and, to me, it makes no difference, either way. The Wall Street Journal will, as usual, live to eat their words. They are always quick to criticize, but never to admit when they’re wrong, which is most of the time! President DONALD J. TRUMP",6.09k,ReTruths,27k,Likes,"Apr 09, 2026, 10:28 PM",09/04/2026 22:28
"Iran is doing a very poor job, dishonorable some would say, of allowing Oil to go through the Strait of Hormuz. That is not the agreement we have! President DONALD J. TRUMP",6.87k,ReTruths,29.3k,Likes,"Apr 09, 2026, 11:29 PM",09/04/2026 23:29
"The Iranians are better at handling the Fake News Media, and “Public Relations,” than they are at fighting! President DONALD J. TRUMP",5.06k,ReTruths,24.3k,Likes,"Apr 10, 2026, 5:27 PM",10/04/2026 17:27
"The Iranians don’t seem to realize they have no cards, other than a short term extortion of the World by using International Waterways. The only reason they are alive today is to negotiate! President DONALD J. TRUMP",6.88k,ReTruths,29.4k,Likes,"Apr 10, 2026, 5:28 PM",10/04/2026 17:28
"Massive numbers of completely empty oil tankers, some of the largest anywhere in the World, are heading, right now, to the United States to load up with the best and “sweetest” oil (and gas!) anywhere in the World. We have more oil than the next two largest oil economies combined - and higher quality. We are waiting for you. Quick turnaround! President DJT",5.92k,ReTruths,23.7k,Likes,"Apr 11, 2026, 12:30 PM",11/04/2026 12:30
"The Fake News Media has lost total credibility, not that they had any to begin with. Because of their massive Trump Derangement Syndrome (Sometimes referred to as TDS!), they love saying that Iran is “winning” when, in fact, everyone knows that they are LOSING, and LOSING BIG! Their Navy is gone, their Air Force is gone, their Anti Aircraft apparatus is nonexistent, Radar is dead, their Missile and Drone Factories have been largely obliterated along with the Missiles and Drones themselves and, most importantly, their longtime “Leaders” are no longer with us, praise be to Allah! The only thing they have going is the threat that a ship may “bunk” into one of their sea mines which, by the way, all 28 of their mine dropper boats are also lying at the bottom of the sea. We’re now starting the process of clearing out the Strait of Hormuz as a favor to Countries all over the World, including China, Japan, South Korea, France, Germany, and many others. Incredibly, they don’t have the Courage or Will to do this work themselves. Very interestingly, however, empty Oil carrying ships from many Nations are all heading to the United States of America to LOAD UP with Oil. Thank you for your attention to this matter! President DONALD J. TRUMP",8.39k,ReTruths,35.5k,Likes,"Apr 11, 2026, 1:58 PM",11/04/2026 13:58
