Post,ReTruths,Nothing,Likes,Nothing,Date and Time,Date and Time
Iran has Violated the Cease Fire numerous times!,5.86k,ReTruths,25k,Likes,"Apr 21, 2026, 12:09 PM",21/04/2026 12:09
"Never allow the Traitor Democrats like Low IQ person Hakeem Jeffries, or Cryin’ Chuck Schumer, or the totally corrupt Fake News Media such as the phony and decaying Wall Street Journal, the Failing New York Times (Subscriptions way down!), or dying “60 Minutes,” to demean or criticize Operation Midnight Hammer, which totally obliterated the Nuclear Dust locations to the point where bloodthirsty Iran has been unable to get to it, or dig it out. Space Force has cameras on every inch of the 3 sites that were so brilliantly hit last June! Thank you for your attention to this matter! President DJT",6.47k,ReTruths,25.9k,Likes,"Apr 21, 2026, 2:37 PM",21/04/2026 14:37
"STATEMENT OF PRESIDENT DONALD J. TRUMP: Based on the fact that the Government of Iran is seriously fractured, not unexpectedly so and, upon the request of Field Marshal Asim Munir, and Prime Minister Shehbaz Sharif, of Pakistan, we have been asked to hold our Attack on the Country of Iran until such time as their leaders and representatives can come up with a unified proposal. I have therefore directed our Military to continue the Blockade and, in all other respects, remain ready and able, and will therefore extend the Ceasefire until such time as their proposal is submitted, and discussions are concluded, one way or the other. President DONALD J. TRUMP",9.52k,ReTruths,42.6k,Likes,"Apr 21, 2026, 9:09 PM",21/04/2026 21:09
"THE WALL STREET JOURNAL HAS LOST ITS WAY! An IDIOT on The Wall Street Journal’s Editorial Board, named Elliot Kaufman, just wrote an Op Ed entitled, “The Iranians Take Trump for a Sucker.” Really? For 47 years, they have killed our people, and many others, and taken advantage of every President, except me — And what did I give to them, a Country in tatters! Their entire Navy is at the bottom of the Sea, their Air Force is gone, their Anti Aircraft and Radar is wiped out, their Nuclear Labs and Storage Areas were OBLITERATED late one dark June evening by our Great B-2 Bombers, their leaders are DEAD, including General Soleimani, their evil genius who destroyed the lives of so many with his favored roadside bombs, the Strait of Hormuz is BLOCKADED and totally controlled by the U.S., with no Ships allowed to go to Iranian Ports — It is said that they are losing 500 Million Dollars a day because of this — Their Country is an Economic Catastrophe, that is hanging by a thread. Barack Hussein Obama gave them 1.7 Billion Dollars in “Green” Cash, flown in by a Boeing 757 to their leaders, and Hundreds of Billions of Dollars in order to help them on their way to a Nuclear Bomb. Other Presidents did nothing to stop them, a BLIGHT on the Office of the Presidency! But despite all of this, I have a MORON on the Editorial Board of The Wall Street Journal writing about me being taken for a “sucker.” Iran certainly doesn’t think so! Neither does anyone else. I guess Rupert Murdoch told him to write it this way, because The Wall Street Journal has lost its way, no longer required reading, just another failing political “RAG!” President DONALD J. TRUMP",4.15k,ReTruths,15.5k,Likes,"Apr 22, 2026, 12:35 AM",22/04/2026 00:35
"Iran doesn’t want the Strait of Hormuz closed, they want it open so they can make $500 Million Dollars a day (which is, therefore, what they are losing if it is closed!). They only say they want it closed because I have it totally BLOCKADED (CLOSED!), so they merely want to “save face.” People approached me four days ago, saying, “Sir, Iran wants to open up the Strait, immediately.” But if we do that, there can never be a Deal with Iran, unless we blow up the rest of their Country, their leaders included! President DONALD J. TRUMP",4.48k,ReTruths,17.4k,Likes,"Apr 22, 2026, 1:36 AM",22/04/2026 01:36
Iran is collapsing financially! They want the Strait of Hormuz opened immediately- Starving for cash! Losing 500 Million Dollars a day. Military and Police complaining that they are not getting paid. SOS!!!,4.76k,ReTruths,20.6k,Likes,"Apr 22, 2026, 4:41 AM",22/04/2026 04:41
