Post,ReTruths,Nothing,Likes,Nothing,Date and Time,Date and Time
Posted the address informing of the first bombing by video,,,,,"Feb 28, 2026, 7:30 AM",28/02/2026 07:30
"Khamenei, one of the most evil people in History, is dead. This is not only Justice for the people of Iran, but for all Great Americans, and those people from many Countries throughout the World, that have been killed or mutilated by Khamenei and his gang of bloodthirsty THUGS. He was unable to avoid our Intelligence and Highly Sophisticated Tracking Systems and, working closely with Israel, there was not a thing he, or the other leaders that have been killed along with him, could do. This is the single greatest chance for the Iranian people to take back their Country. We are hearing that many of their IRGC, Military, and other Security and Police Forces, no longer want to fight, and are looking for Immunity from us. As I said last night, “Now they can have Immunity, later they only get Death!” Hopefully, the IRGC and Police will peacefully merge with the Iranian Patriots, and work together as a unit to bring back the Country to the Greatness it deserves. That process should soon be starting in that, not only the death of Khamenei but the Country has been, in only one day, very much destroyed and, even, obliterated. The heavy and pinpoint bombing, however, will continue, uninterrupted throughout the week or, as long as necessary to achieve our objective of PEACE THROUGHOUT THE MIDDLE EAST AND, INDEED, THE WORLD! Thank you for your attention to this matter. PRESIDENT DONALD J. TRUMP",26.8k,ReTruths,100k,Likes,"Feb 28, 2026, 9:37 PM",28/02/2026 21:37
"Iran just stated that they are going to hit very hard today, harder than they have ever hit before. THEY BETTER NOT DO THAT, HOWEVER, BECAUSE IF THEY DO, WE WILL HIT THEM WITH A FORCE THAT HAS NEVER BEEN SEEN BEFORE! Thank you for your attention to this matter! President DONALD J. TRUMP",9.89k,ReTruths,41.1k,Likes,"Mar 01, 2026, 5:25 AM",01/03/2026 05:25
"I have just been informed that we have destroyed and sunk 9 Iranian Naval Ships, some of them relatively large and important. We are going after the rest — They will soon be floating at the bottom of the sea, also! In a different attack, we largely destroyed their Naval Headquarters. Other than that, their Navy is doing very well! PRESIDENT DONALD J. TRUMP",8.25k,ReTruths,33.1k,Likes,"Mar 01, 2026, 5:21 PM",01/03/2026 17:21
"If I didn’t terminate Obama’s horrendous Iran Nuclear Deal (JCPOA), Iran would have had a Nuclear Weapon three years ago. That was the most dangerous transaction we have ever entered into, and had it been allowed to stand, the World would be an entirely different place right now. You can blame Barack Hussein Obama, and Sleepy Joe Biden. THANK YOU PRESIDENT TRUMP!",5.27k,ReTruths,18.4k,Likes,"Mar 02, 2026, 9:43 PM",02/03/2026 21:43
"The Radical Left Democrats, a Party that has completely lost its way, are complaining bitterly about the very necessary and important attack, by the United States and Israel, on Iran. What most people understand is that they are only complaining BECAUSE I DID IT and, if I didn’t do it, they would be screaming — Why didn’t “TRUMP” attack Iran, he should do it, IMMEDIATELY? There’s nothing surprising about this! It’s the same people that the other night at The State of the Union Address wouldn’t stand for ANYBODY, including a mother who lost her beautiful daughter to an illegal alien, a Great and Brave Helicopter Pilot, who got the Congressional Medal of Honor, or a 100-year-old Veteran Warrior whose Bravery is Legend! The fact is, whatever I do, they will be on the opposite side. These people are SICK, CRAZY, and DEMENTED, but America, despite them all, is now BIGGER, BETTER, AND STRONGER THAN EVER BEFORE. MAKE AMERICA GREAT AGAIN! President DONALD J. TRUMP",12.6k,ReTruths,53.8k,Likes,"Mar 02, 2026, 11:20 PM",02/03/2026 23:20
"The United States Munitions Stockpiles have, at the medium and upper medium grade, never been higher or better - As was stated to me today, we have a virtually unlimited supply of these weapons. Wars can be fought “forever,” and very successfully, using just these supplies (which are better than other countries finest arms!). At the highest end, we have a good supply, but are not where we want to be. Much additional high grade weaponry is stored for us in outlying countries. Sleepy Joe Biden spent all of his time, and our Country’s money, GIVING everything to P.T. Barnum (Zelenskyy!) of Ukraine - Hundreds of Billions of Dollars worth - And, while he gave so much of the super high end away (FREE!), he didn’t bother to replace it. Fortunately, I rebuilt the military in my first term, and continue to do so. The United States is stocked, and ready to WIN, BIG!!! Thank you for your attention to this matter. President DONALD J. TRUMP",7.3k,ReTruths,30.6k,Likes,"Mar 03, 2026, 4:56 AM",03/03/2026 04:56
"Effective IMMEDIATELY, I have ordered the United States Development Finance Corporation (DFC) to provide, at a very reasonable price, political risk insurance and guarantees for the Financial Security of ALL Maritime Trade, especially Energy, traveling through the Gulf. This will be available to all Shipping Lines. If necessary, the United States Navy will begin escorting tankers through the Strait of Hormuz, as soon as possible. No matter what, the United States will ensure the FREE FLOW of ENERGY to the WORLD. The United States’ ECONOMIC and MILITARY MIGHT is the GREATEST ON EARTH — More actions to come. Thank you for your attention to this matter! President DONALD J. TRUMP",10.1k,ReTruths,42.3k,Likes,"Mar 03, 2026, 7:37 PM",03/03/2026 19:37
"Since the launch of Operation Epic Fury, more than 9,000 Americans have safely returned home from the Middle East. If you are a U.S. Citizen in the Middle East, and you want to come home, please register with the State Department at Step.State.Gov.  The Department will identify where you are, and provide travel options to you. We are already chartering flights, free of charge, and booking commercial options, which we expect will become increasingly available as time goes on.",6.98k,ReTruths,24.9k,Likes,"Mar 03, 2026, 10:57 PM",03/03/2026 22:57
"There will be no deal with Iran except UNCONDITIONAL SURRENDER! After that, and the selection of a GREAT & ACCEPTABLE Leader(s), we, and many of our wonderful and very brave allies and partners, will work tirelessly to bring Iran back from the brink of destruction, making it economically bigger, better, and stronger than ever before. IRAN WILL HAVE A GREAT FUTURE. “MAKE IRAN GREAT AGAIN (MIGA!).” Thank you for your attention to this matter! President DONALD J. TRUMP",6.67k,ReTruths,22.3k,Likes,"Mar 06, 2026, 1:50 PM",06/03/2026 13:50
"We are moving thousands of people out of various Countries throughout the Middle East. It is being done quietly, but seamlessly. The State Department, under Secretary Marco Rubio, is doing a great job! President DONALD J. TRUMP",6.43k,ReTruths,32.5k,Likes,"Mar 06, 2026, 3:08 PM",06/03/2026 15:08
"We just concluded a very good meeting with the largest U.S. Defense Manufacturing Companies where we discussed Production and Production Schedules. They have agreed to quadruple Production of the “Exquisite Class” Weaponry in that we want to reach, as rapidly as possible, the highest levels of quantity. Expansion began three months prior to the meeting, and Plants and Production of many of these Weapons are already under way. We have a virtually unlimited supply of Medium and Upper Medium Grade Munitions, which we are using, as an example, in Iran, and recently used in Venezuela. Regardless, however, we have also increased Orders at these levels. The Companies represented were the CEOs of BAE Systems, Boeing, Honeywell Aerospace, L3Harris Missile Solutions, Lockheed Martin, Northrop Grumman, and Raytheon. The meeting concluded with another meeting scheduled in two months. States all over the Country are bidding for these new Plants. Thank you for your attention to this matter! President DONALD J. TRUMP",8.13k,ReTruths,37k,Likes,"Mar 06, 2026, 8:46 PM",06/03/2026 20:46
"I will be going to Dover Air Force Base tomorrow, with the First Lady and Members of my Cabinet, to pay our Highest Respect to our Great Warriors, who are returning home for the last time. GOD BLESS THEM ALL! President DONALD J. TRUMP",6.73k,ReTruths,31k,Likes,"Mar 07, 2026, 1:35 AM",07/03/2026 01:35
"Iran, which is being beat to HELL, has apologized and surrendered to its Middle East neighbors, and promised that it will not shoot at them anymore. This promise was only made because of the relentless U.S. and Israeli attack. They were looking to take over and rule the Middle East. It is the first time that Iran has ever lost, in thousands of years, to surrounding Middle Eastern Countries. They have said, “Thank you President Trump.” I have said, “You’re welcome!” Iran is no longer the “Bully of the Middle East,” they are, instead, “THE LOSER OF THE MIDDLE EAST,” and will be for many decades until they surrender or, more likely, completely collapse! Today Iran will be hit very hard! Under serious consideration for complete destruction and certain death, because of Iran’s bad behavior, are areas and groups of people that were not considered for targeting up until this moment in time. Thank you for your attention to this matter! President DONALD J. TRUMP",14.8k,ReTruths,61.9k,Likes,"Mar 07, 2026, 11:11 AM",07/03/2026 11:11
"The United Kingdom, our once Great Ally, maybe the Greatest of them all, is finally giving serious thought to sending two aircraft carriers to the Middle East. That’s OK, Prime Minister Starmer, we don’t need them any longer — But we will remember. We don’t need people that join Wars after we’ve already won! President DONALD J. TRUMP",12.9k,ReTruths,51.8k,Likes,"Mar 07, 2026, 9:05 PM",07/03/2026 21:05
"Short term oil prices, which will drop rapidly when the destruction of the Iran nuclear threat is over, is a very small price to pay for U.S.A., and World, Safety and Peace. ONLY FOOLS WOULD THINK DIFFERENTLY!President DJT",9.7k,ReTruths,40.4k,Likes,"Mar 08, 2026, 10:54 PM",08/03/2026 22:54
"If Iran does anything that stops the flow of Oil within the Strait of Hormuz, they will be hit by the United States of America TWENTY TIMES HARDER than they have been hit thus far. Additionally, we will take out easily destroyable targets that will make it virtually impossible for Iran to ever be built back, as a Nation, again — Death, Fire, and Fury will reign upon them — But I hope, and pray, that it does not happen! This is a gift from the United States of America to China, and all of those Nations that heavily use the Hormuz Strait. Hopefully, it is a gesture that will be greatly appreciated. Thank you for your attention to this matter! President DONALD J. TRUMP",9.29k,ReTruths,37.4k,Likes,"Mar 10, 2026, 12:30 AM",10/03/2026 12:30
"If Iran has put out any mines in the Hormuz Strait, and we have no reports of them doing so, we want them removed, IMMEDIATELY! If for any reason mines were placed, and they are not removed forthwith, the Military consequences to Iran will be at a level never seen before. If, on the other hand, they remove what may have been placed, it will be a giant step in the right direction! Additionally, we are using the same Technology and Missile capabilities deployed against Drug Traffickers to permanently eliminate any boat or ship attempting to mine the Hormuz Strait. They will be dealt with quickly and violently. BEWARE! President DONALD J. TRUMP",9.44k,ReTruths,41.3k,Likes,"Mar 10, 2026, 8:07 PM",10/03/2026 20:07
"I am pleased to report that within the last few hours, we have hit, and completely destroyed, 10 inactive mine laying boats and/or ships, with more to follow! President DONALD J. TRUMP",6.35k,ReTruths,28.1k,Likes,"Mar 10, 2026, 8:20 PM",10/03/2026 20:20
"The United States is the largest Oil Producer in the World, by far, so when oil prices go up, we make a lot of money. BUT, of far greater interest and importance to me, as President, is stoping an evil Empire, Iran, from having Nuclear Weapons, and destroying the Middle East and, indeed, the World. I won’t ever let that happen! Thank you for your attention to this matter. President DONALD J. TRUMP",9.78k,ReTruths,45.2k,Likes,"Mar 12, 2026, 1:14 PM",12/03/2026 13:14
"The Iran National Soccer Team is welcome to The World Cup, but I really don’t believe it is appropriate that they be there, for their own life and safety. Thank you for your attention to this matter! President DONALD J. TRUMP",6.43k,ReTruths,32.1k,Likes,"Mar 12, 2026, 3:00 PM",12/03/2026 15:00
"We are totally destroying the terrorist regime of Iran, militarily, economically, and otherwise, yet, if you read the Failing New York Times, you would incorrectly think that we are not winning. Iran’s Navy is gone, their Air Force is no longer, missiles, drones and everything else are being decimated, and their leaders have been wiped from the face of the earth. We have unparalleled firepower, unlimited ammunition, and plenty of time - Watch what happens to these deranged scumbags today. They’ve been killing innocent people all over the world for 47 years, and now I, as the 47th President of the United States of America, am killing them. What a great honor it is to do so! Thank you for your attention to this matter. President DONALD J. TRUMP",8.35k,ReTruths,31.3k,Likes,"Mar 13, 2026, 4:33 AM",13/03/2026 04:33
"Moments ago, at my direction, the United States Central Command executed one of the most powerful bombing raids in the History of the Middle East, and totally obliterated every MILITARY target in Iran’s crown jewel, Kharg Island. Our Weapons are the most powerful and sophisticated that the World has ever known but, for reasons of decency, I have chosen NOT to wipe out the Oil Infrastructure on the Island. However, should Iran, or anyone else, do anything to interfere with the Free and Safe Passage of Ships through the Strait of Hormuz, I will immediately reconsider this decision. During my First Term, and currently, I rebuilt our Military into the Most Lethal, Powerful, and Effective Force, by far, anywhere in the World. Iran has NO ability to defend anything that we want to attack — There is nothing they can do about it! Iran will NEVER have a nuclear weapon, nor will it have the ability to threaten the United States of America, the Middle East or, for that matter, the World! Iran’s Military, and all others involved with this Terrorist Regime, would be wise to lay down their arms, and save what’s left of their country, which isn’t much! Thank you for your attention to this matter. President DONALD J. TRUMP",10.2k,ReTruths,40.2k,Likes,"Mar 13, 2026, 10:54 PM",13/03/2026 22:54
"Moments ago, at my direction, the United States Central Command executed one of the most powerful bombing raids in the History of the Middle East, and totally obliterated every MILITARY target in Iran’s crown jewel, Kharg Island. Our Weapons are the most powerful and sophisticated that the World has ever known but, for reasons of decency, I have chosen NOT to wipe out the Oil Infrastructure on the Island. However, should Iran, or anyone else, do anything to interfere with the Free and Safe Passage of Ships through the Strait of Hormuz, I will immediately reconsider this decision. During my First Term, and currently, I rebuilt our Military into the Most Lethal, Powerful, and Effective Force, by far, anywhere in the World. Iran has NO ability to defend anything that we want to attack — There is nothing they can do about it! Iran will NEVER have a nuclear weapon, nor will it have the ability to threaten the United States of America, the Middle East or, for that matter, the World! Iran’s Military, and all others involved with this Terrorist Regime, would be wise to lay down their arms, and save what’s left of their country, which isn’t much! Thank you for your attention to this matter. President DONALD J. TRUMP",10.2k,ReTruths,40.2k,Likes,"Mar 13, 2026, 10:54 PM",13/03/2026 22:54
"Iran had plans of taking over the entire Middle East, and completely obliterating Israel. JUST LIKE IRAN ITSELF, THOSE PLANS ARE NOW DEAD! President DONALD J. TRUMP",8.15k,ReTruths,35.8k,Likes,"Mar 13, 2026, 11:43 PM",13/03/2026 23:43
"Iran had plans of taking over the entire Middle East, and completely obliterating Israel. JUST LIKE IRAN ITSELF, THOSE PLANS ARE NOW DEAD! President DONALD J. TRUMP",8.15k,ReTruths,35.8k,Likes,"Mar 13, 2026, 11:43 PM",13/03/2026 23:43
"The Fake News Media hates to report how well the United States Military has done against Iran, which is totally defeated and wants a deal - But not a deal that I would accept! Thank you for your attention to this matter. President DJT",7.71k,ReTruths,33.3k,Likes,"Mar 14, 2026, 3:53 AM",14/03/2026 03:53
"Yet again, an intentionally misleading headline by the Fake News Media about the five tanker planes that were supposedly struck down at an Airport in Saudi Arabia, and of no further use. In actuality, the Base was hit a few days ago, but the planes were not “struck” or “destroyed.” Four of the five had virtually no damage, and are already back in service. One had slightly more damage, but will be in the air shortly. None were destroyed, or close to that, as the Fake News said in headlines. The New York Times and The Wall Street Journal (in particular), and other Lowlife “Papers” and Media actually want us to lose the War. Their terrible reporting is the exact opposite of the actual facts! They are truly sick and demented people that have no idea the damage they cause the United States of America. Fortunately, as proven by our Great and Conclusive Election Win in 2024, the People of our Country understand what is happening far better than the Fake News Media! President DONALD J. TRUMP",12.4k,ReTruths,47.8k,Likes,"Mar 14, 2026, 1:35 PM",14/03/2026 13:35
"Many Countries, especially those who are affected by Iran’s attempted closure of the Hormuz Strait, will be sending War Ships, in conjunction with the United States of America, to keep the Strait open and safe. We have already destroyed 100% of Iran’s Military capability, but it’s easy for them to send a drone or two, drop a mine, or deliver a close range missile somewhere along, or in, this Waterway, no matter how badly defeated they are. Hopefully China, France, Japan, South Korea, the UK, and others, that are affected by this artificial constraint, will send Ships to the area so that the Hormuz Strait will no longer be a threat by a Nation that has been totally decapitated. In the meantime, the United States will be bombing the hell out of the shoreline, and continually shooting Iranian Boats and Ships out of the water. One way or the other, we will soon get the Hormuz Strait OPEN, SAFE, and FREE! President DONALD J. TRUMP",8.26k,ReTruths,34.1k,Likes,"Mar 14, 2026, 2:04 PM",14/03/2026 14:04
"The United States of America has beaten and completely decimated Iran, both Militarily, Economically, and in every other way, but the Countries of the World that receive Oil through the Hormuz Strait must take care of that passage, and we will help — A LOT! The U.S. will also coordinate with those Countries so that everything goes quickly, smoothly, and well. This should have always been a team effort, and now it will be — It will bring the World together toward Harmony, Security, and Everlasting Peace! President DONALD J. TRUMP",9.48k,ReTruths,39.3k,Likes,"Mar 14, 2026, 6:58 PM",14/03/2026 18:58
"Iran has long been known as a Master of Media Manipulation and Public Relations. They are Militarily ineffective and weak, but are really good at “feeding” the very appreciative Fake News Media false information. Now, A.I. has become another Disinformation weapon that Iran uses, quite well, considering they are being annihilated by the day. They showed phony “Kamikaze Boats,” shooting at various Ships at Sea, which looks wonderful, powerful, and vicious, but these Boats don’t exist — It’s all false information to show how “tough” their already defeated Military is! The five U.S. Refueling Planes that were supposedly struck down and badly damaged, according to The Wall Street Journal’s false reporting, and others, are all in service, with the exception of one, which will soon be flying the skies. Buildings and Ships that are shown to be on fire are not — It’s FAKE NEWS, generated by A.I. For instance, Iran, working in close coordination with the Fake News Media, shows our great USS Abraham Lincoln Aircraft Carrier, one of the largest and most prestigious Ships in the World, burning uncontrollably in the Ocean. Not only was it not burning, it was not even shot at — Iran knows better than to do that! The story was knowingly FAKE and, in a certain way, you can say that those Media Outlets that generated it should be brought up on Charges for TREASON for the dissemination of false information! The fact is, Iran is being decimated, and the only battles they “win” are those that they create through AI, and are distributed by Corrupt Media Outlets. The Radical Leftwing Press knows this full well, but continues to go forward with false stories and LIES. That’s why their Approval Rating is so low, and I can win a Presidential Election, IN A LANDSLIDE, getting only 5% positive Press — They have no credibility! I am so thrilled to see Brendan Carr, the Chairman of the Federal Communications Commission (FCC), looking at the licenses of some of these Corrupt and Highly Unpatriotic “News” Organizations. They get Billions of Dollars of FREE American Airwaves, and use it to perpetuate LIES, both in News and almost all of their Shows, including the Late Night Morons, who get gigantic Salaries for horrible Ratings, and never get, as I used to say in The Apprentice, “FIRED.” Thank you for your attention to this matter! President DONALD J. TRUMP",8.46k,ReTruths,28.1k,Likes,"Mar 15, 2026, 11:48 PM",15/03/2026 23:48
"The United States has been informed by most of our NATO “Allies” that they don’t want to get involved with our Military Operation against the Terrorist Regime of Iran, in the Middle East, this, despite the fact that almost every Country strongly agreed with what we are doing, and that Iran cannot, in any way, shape, or form, be allowed to have a Nuclear Weapon. I am not surprised by their action, however, because I always considered NATO, where we spend Hundreds of Billions of Dollars per year protecting these same Countries, to be a one way street — We will protect them, but they will do nothing for us, in particular, in a time of need. Fortunately, we have decimated Iran’s Military — Their Navy is gone, their Air Force is gone, their Anti-Aircraft and Radar is gone and perhaps, most importantly, their Leaders, at virtually every level, are gone, never to threaten us, our Middle Eastern Allies, or the World, again! Because of the fact that we have had such Military Success, we no longer “need,” or desire, the NATO Countries’ assistance — WE NEVER DID! Likewise, Japan, Australia, or South Korea. In fact, speaking as President of the United States of America, by far the Most Powerful Country Anywhere in the World, WE DO NOT NEED THE HELP OF ANYONE! Thank you for your attention to this matter. President DONALD J. TRUMP",13k,ReTruths,49.7k,Likes,"Mar 17, 2026, 3:18 PM",17/03/2026 15:18
"Remember, for all of those absolute “fools” out there, Iran is considered, by everyone, to be the NUMBER ONE STATE SPONSOR OF TERROR. We are rapidly putting them out of business!",5.98k,ReTruths,25.2k,Likes,"Mar 18, 2026, 12:01 PM",19/03/2026 00:01
"I wonder what would happen if we “finished off” what’s left of the Iranian Terror State, and let the Countries that use it, we don’t, be responsible for the so called “Strait?” That would get some of our non-responsive “Allies” in gear, and fast!!! President DJT",5.56k,ReTruths,23.2k,Likes,"Mar 18, 2026, 12:35 PM",19/03/2026 00:35
"Israel, out of anger for what has taken place in the Middle East, has violently lashed out at a major facility known as South Pars Gas Field in Iran. A relatively small section of the whole has been hit. The United States knew nothing about this particular attack, and the country of Qatar was in no way, shape, or form, involved with it, nor did it have any idea that it was going to happen. Unfortunately, Iran did not know this, or any of the pertinent facts pertaining to the South Pars attack, and unjustifiably and unfairly attacked a portion of Qatar’s LNG Gas facility. NO MORE ATTACKS WILL BE MADE BY ISRAEL pertaining to this extremely important and valuable South Pars Field unless Iran unwisely decides to attack a very innocent, in this case, Qatar - In which instance the United States of America, with or without the help or consent of Israel, will massively blow up the entirety of the South Pars Gas Field at an amount of strength and power that Iran has never seen or witnessed before. I do not want to authorize this level of violence and destruction because of the long term implications that it will have on the future of Iran, but if Qatar’s LNG is again attacked, I will not hesitate to do so. Thank you for your attention to this matter. President DONALD J. TRUMP",6.67k,ReTruths,24.3k,Likes,"Mar 19, 2026, 2:05 AM",19/03/2026 02:05
