Post,ReTruths,Nothing,Likes,Nothing,Date and Time,Date and Time
"The Fake News Media has lost total credibility, not that they had any to begin with. Because of their massive Trump Derangement Syndrome (Sometimes referred to as TDS!), they love saying that Iran is “winning” when, in fact, everyone knows that they are LOSING, and LOSING BIG! Their Navy is gone, their Air Force is gone, their Anti Aircraft apparatus is nonexistent, Radar is dead, their Missile and Drone Factories have been largely obliterated along with the Missiles and Drones themselves and, most importantly, their longtime “Leaders” are no longer with us, praise be to Allah! The only thing they have going is the threat that a ship may “bunk” into one of their sea mines which, by the way, all 28 of their mine dropper boats are also lying at the bottom of the sea. We’re now starting the process of clearing out the Strait of Hormuz as a favor to Countries all over the World, including China, Japan, South Korea, France, Germany, and many others. Incredibly, they don’t have the Courage or Will to do this work themselves. Very interestingly, however, empty Oil carrying ships from many Nations are all heading to the United States of America to LOAD UP with Oil. Thank you for your attention to this matter! President DONALD J. TRUMP",8.39k,ReTruths,35.5k,Likes,"Apr 11, 2026, 1:58 PM",11/04/2026 13:58
"I am watching fertilizer prices CLOSELY during our FIGHT FOR FREEDOM in Iran. The United States will not accept PRICE GOUGING from the fertilizer monopoly! American Farmers, we have your back! President DONALD J. TRUMP",6.34k,ReTruths,28.3k,Likes,"Apr 11, 2026, 2:07 PM",11/04/2026 14:07
"The Fake News Media is CRAZY, or just plain CORRUPT! The United States has completely destroyed Iran’s Military, including their entire Navy and Air Force, and everything else. Their Leadership is DEAD! The Strait of Hormuz will soon be open, and the empty ships are rushing to the United States to “load up.” But, if you listen to the Fake News, we’re losing! President DONALD J. TRUMP",12.8k,ReTruths,54.3k,Likes,"Apr 11, 2026, 4:17 PM",11/04/2026 16:17
"Iran promised to open the Strait of Hormuz, and they knowingly failed to do so. This caused anxiety, dislocation, and pain to many people and Countries throughout the World. They say they put mines in the water, even though all of their Navy, and most of their “mine droppers,” have been completely blown up. They may have done so, but what ship owner would want to take the chance? There is great dishonor and permanent harm to the reputation of Iran, and what’s left of their “Leaders,” but we are beyond all of that. As they promised, they better begin the process of getting this INTERNATIONAL WATERWAY OPEN AND FAST! Every Law in the book is being violated by them. I have been fully debriefed by Vice President JD Vance, Special Envoy Steve Witkoff, and Jared Kushner, on the meeting that took place in Islamabad through the kind and very competent leadership of Field Marshal Asim Munir, and Prime Minister Shehbaz Sharif, of Pakistan. They are very extraordinary men, and continuously thank me for saving 30 to 50 million lives in what would have been a horrendous War with India. I always appreciate hearing that — The amount of Humanity spoken of is incomprehensible. The meeting with Iran began early in the morning, and lasted throughout the night — Close to 20 hours. I could go into great detail, and talk about much that has been gotten but, there is only one thing that matters — IRAN IS UNWILLING TO GIVE UP ITS NUCLEAR AMBITIONS! In many ways, the points that were agreed to are better than us continuing our Military Operations to conclusion, but all of those points don’t matter compared to allowing Nuclear Power to be in the hands of such volatile, difficult, unpredictable people. My three Representatives, as all of this time went by, became, not surprisingly, very friendly and respectful of Iran’s Representatives, Mohammad-Bagher Ghalibaf, Abbas Araghchi, and Ali Bagheri, but that doesn’t matter because they were very unyielding as to the single most important issue and, as I have always said, right from the beginning, and many years ago, IRAN WILL NEVER HAVE A NUCLEAR WEAPON! So, there you have it, the meeting went well, most points were agreed to, but the only point that really mattered, NUCLEAR, was not. Effective immediately, the United States Navy, the Finest in the World, will begin the process of BLOCKADING any and all Ships trying to enter, or leave, the Strait of Hormuz. At some point, we will reach an “ALL BEING ALLOWED TO GO IN, ALL BEING ALLOWED TO GO OUT” basis, but Iran has not allowed that to happen by merely saying, “There may be a mine out there somewhere,” that nobody knows about but them. THIS IS WORLD EXTORTION, and Leaders of Countries, especially the United States of America, will never be extorted. I have also instructed our Navy to seek and interdict every vessel in International Waters that has paid a toll to Iran. No one who pays an illegal toll will have safe passage on the high seas. We will also begin destroying the mines the Iranians laid in the Straits. Any Iranian who fires at us, or at peaceful vessels, will be BLOWN TO HELL! Iran knows, better than anyone, how to END this situation which has already devastated their Country. Their Navy is gone, their Air Force is gone, their Anti Aircraft and Radar are useless, Khamenei, and most of their “Leaders,” are dead, all because of their Nuclear ambition. The Blockade will begin shortly. Other Countries will be involved with this Blockade. Iran will not be allowed to profit off this Illegal Act of EXTORTION. They want money and, more importantly, they want Nuclear. Additionally and, at an appropriate moment, we are fully “LOCKED AND LOADED,” and our Military will finish up the little that is left of Iran! President DONALD J. TRUMP",5.87k,ReTruths,24.5k,Likes,"Apr 12, 2026, 4:30 PM",12/04/2026 16:30
"Pope Leo is WEAK on Crime, and terrible for Foreign Policy. He talks about “fear” of the Trump Administration, but doesn’t mention the FEAR that the Catholic Church, and all other Christian Organizations, had during COVID when they were arresting priests, ministers, and everybody else, for holding Church Services, even when going outside, and being ten and even twenty feet apart. I like his brother Louis much better than I like him, because Louis is all MAGA. He gets it, and Leo doesn’t! I don’t want a Pope who thinks it’s OK for Iran to have a Nuclear Weapon. I don’t want a Pope who thinks it’s terrible that America attacked Venezuela, a Country that was sending massive amounts of Drugs into the United States and, even worse, emptying their prisons, including murderers, drug dealers, and killers, into our Country. And I don’t want a Pope who criticizes the President of the United States because I’m doing exactly what I was elected, IN A LANDSLIDE, to do, setting Record Low Numbers in Crime, and creating the Greatest Stock Market in History. Leo should be thankful because, as everyone knows, he was a shocking surprise. He wasn’t on any list to be Pope, and was only put there by the Church because he was an American, and they thought that would be the best way to deal with President Donald J. Trump. If I wasn’t in the White House, Leo wouldn’t be in the Vatican. Unfortunately, Leo’s Weak on Crime, Weak on Nuclear Weapons, does not sit well with me, nor does the fact that he meets with Obama Sympathizers like David Axelrod, a LOSER from the Left, who is one of those who wanted churchgoers and clerics to be arrested. Leo should get his act together as Pope, use Common Sense, stop catering to the Radical Left, and focus on being a Great Pope, not a Politician. It’s hurting him very badly and, more importantly, it’s hurting the Catholic Church! President DONALD J. TRUMP",8.22k,ReTruths,31.1k,Likes,"Apr 13, 2026, 2:03 AM",13/04/2026 02:03
The United States to Blockade Ships Entering or Exiting Iranian Ports on April 13 at 10:00 A.M. ET. Thank you for your attention to this matter! President DJT,5.44k,ReTruths,25.3k,Likes,"Apr 13, 2026, 5:43 AM",13/04/2026 05:43
"Iran’s Navy is laying at the bottom of the sea, completely obliterated - 158 ships. What we have not hit are their small number of, what they call, “fast attack ships,” because we did not consider them much of a threat. Warning: If any of these ships come anywhere close to our BLOCKADE, they will be immediately ELIMINATED, using the same system of kill that we use against the drug dealers on boats at Sea. It is quick and brutal. P.S. 98.2% of Drugs coming into the U.S. by Ocean or Sea have STOPPED! Thank you for your attention to this matter. President DJT",11.6k,ReTruths,56.2k,Likes,"Apr 13, 2026, 3:23 PM",13/04/2026 15:23
"34 Ships went through the Strait of Hormuz yesterday, which is by far the highest number since this foolish closure began. President DONALD J. TRUMP",6.17k,ReTruths,29.2k,Likes,"Apr 13, 2026, 5:33 PM",13/04/2026 17:33
"For those people that still read The Failing New York Times and, despite the fact that Iran has been totally OBLITERATED, Militarily, and otherwise, you would think that Iran is actually winning or, at the very least, doing quite well — But that’s not true, and The New York Times knows that it’s FAKE NEWS! When does this Corrupt Media Outlet apologize for their LIES and horrible actions against me, my supporters, and our Country itself! HAVE THEY NO SHAME? HAVE THEY NO SENSE OF DECENCY? President DONALD J. TRUMP",4.59k,ReTruths,18.2k,Likes,"Apr 13, 2026, 9:54 PM",13/04/2026 21:54
"Europe is desperate for Energy, and yet the United Kingdom refuses to open North Sea Oil, one of the greatest fields in the World. Tragic!!! Aberdeen should be booming. Norway sells its North Sea Oil to the U.K. at double the price. They are making a fortune. U.K., which is better situated on the North Sea for purposes of energy than Norway, should, DRILL, BABY, DRILL!!! It is absolutely crazy that they don’t… AND, NO MORE WINDMILLS! President DJT",8.94k,ReTruths,39.7k,Likes,"Apr 14, 2026, 3:30 PM",14/04/2026 15:30
"Will someone please tell Pope Leo that Iran has killed at least 42,000 innocent, completely unarmed, protesters in the last two months, and that for Iran to have a Nuclear Bomb is absolutely unacceptable. Thank you for your attention to this matter. AMERICA IS BACK!!! President DONALD J. TRUMP",6.93k,ReTruths,24.3k,Likes,"Apr 15, 2026, 4:34 AM",15/04/2026 04:34
"NATO wasn’t there for us, and they won’t be there for us in the future! President DONALD J. TRUMP",4.89k,ReTruths,19.4k,Likes,"Apr 15, 2026, 4:39 AM",15/04/2026 04:39
"China is very happy that I am permanently opening the Strait of Hormuz. I am doing it for them, also - And the World. This situation will never happen again. They have agreed not to send weapons to Iran. President Xi will give me a big, fat, hug when I get there in a few weeks. We are working together smartly, and very well! Doesn’t that beat fighting??? BUT REMEMBER, we are very good at fighting, if we have to - far better than anyone else!!! President DJT",9.91k,ReTruths,46.8k,Likes,"Apr 15, 2026, 12:46 PM",15/04/2026 12:46
"Trying to get a little breathing room between Israel and Lebanon. It has been a long time since the two leaders have spoken, like 34 years. It will happen tomorrow. Nice! President DJT",6.12k,ReTruths,30k,Likes,"Apr 16, 2026, 4:26 AM",16/04/2026 04:26
"I just had excellent conversations with the Highly Respected President Joseph Aoun, of Lebanon, and Prime Minister Bibi Netanyahu, of Israel. These two Leaders have agreed that in order to achieve PEACE between their Countries, they will formally begin a 10 Day CEASEFIRE at 5 P.M. EST. On Tuesday, the two Countries met for the first time in 34 years here in Washington, D.C., with our Great Secretary of State, Marco Rubio. I have directed Vice President JD Vance and Secretary of State Rubio, together with the Chairman of the Joint Chiefs of Staff, Dan Razin' Caine, to work with Israel and Lebanon to achieve a Lasting PEACE. It has been my Honor to solve 9 Wars across the World, and this will be my 10th, so let's, GET IT DONE! President DONALD J. TRUMP",7.15k,ReTruths,33.3k,Likes,"Apr 16, 2026, 4:36 PM",16/04/2026 16:36
"In addition to the statement just issued, I will be inviting the Prime Minister of Israel, Bibi Netanyahu, and the President of Lebanon, Joseph Aoun, to the White House for the first meaningful talks between Israel and Lebanon since 1983, a very long time ago. Both sides want to see PEACE, and I believe that will happen, quickly! President DONALD J. TRUMP",4.23k,ReTruths,17.5k,Likes,"Apr 16, 2026, 4:53 PM",16/04/2026 16:53
"Italy wasn’t there for us, we won’t be there for them! President DONALD J. TRUMP",2.31k,ReTruths,8.97k,Likes,"Apr 16, 2026, 10:19 PM",16/04/2026 22:19
I hope Hezbollah acts nicely and well during this important period of time. It will be an GREAT moment for them if they do. No more killing. Must finally have PEACE! Thank you for your attention to this matter. President DONALD J. TRUMP,4.98k,ReTruths,24.4k,Likes,"Apr 17, 2026, 12:22 AM",17/04/2026 00:22
May have been a historic day for Lebanon. Good things are happening!!! President DJT,4.32k,ReTruths,22.8k,Likes,"Apr 17, 2026, 3:48 AM",17/04/2026 03:48
"The U.S.A. is the “HOTTEST” Country in the World right now. Just a short time ago, under Sleepy Joe Biden, IT WAS DEAD, LAUGHED AT ALL OVER THE WORLD!!! But not anymore - Nobody’s laughing!!! President DJT",3.63k,ReTruths,17.3k,Likes,"Apr 17, 2026, 1:26 PM",17/04/2026 13:26
IRAN HAS JUST ANNOUNCED THAT THE STRAIT OF IRAN IS FULLY OPEN AND READY FOR FULL PASSAGE. THANK YOU!,6.5k,ReTruths,32.6k,Likes,"Apr 17, 2026, 2:06 PM",17/04/2026 14:06
"THE STRAIT OF HORMUZ IS COMPLETELY OPEN AND READY FOR BUSINESS AND FULL PASSAGE, BUT THE NAVAL BLOCKADE WILL REMAIN IN FULL FORCE AND EFFECT AS IT PERTAINS TO IRAN, ONLY, UNTIL SUCH TIME AS OUR TRANSACTION WITH IRAN IS 100% COMPLETE. THIS PROCESS SHOULD GO VERY QUICKLY IN THAT MOST OF THE POINTS ARE ALREADY NEGOTIATED. THANK YOU FOR YOUR ATTENTION TO THIS MATTER! PRESIDENT DONALD J.TRUMP",4.45k,ReTruths,19.2k,Likes,"Apr 17, 2026, 2:27 PM",17/04/2026 14:27
"The U.S.A. will get all Nuclear “Dust,” created by our great B2 Bombers - No money will exchange hands in any way, shape, or form. This deal is in no way subject to Lebanon, either, but the USA will, separately, work with Lebanon, and deal with the Hezboolah situation in an appropriate manner. Israel will not be bombing Lebanon any longer. They are PROHIBITED from doing so by the U.S.A. Enough is enough!!! Thank you! President DJT",5.14k,ReTruths,24k,Likes,"Apr 17, 2026, 2:57 PM",17/04/2026 14:57
"Now that the Hormuz Strait situation is over, I received a call from NATO asking if we would need some help. I TOLD THEM TO STAY AWAY, UNLESS THEY JUST WANT TO LOAD UP THEIR SHIPS WITH OIL. They were useless when needed, a Paper Tiger! President DJT",3.8k,ReTruths,16.5k,Likes,"Apr 17, 2026, 3:13 PM",17/04/2026 15:13
"Thank you to Saudi Arabia, UAE, and Qatar for your great bravery and help! President DONALD J. TRUMP",2.62k,ReTruths,13.5k,Likes,"Apr 17, 2026, 3:16 PM",17/04/2026 15:16
"Iran, with the help of the U.S.A., has removed, or is removing, all sea mines! Thank you! President DJT",2.61k,ReTruths,13.6k,Likes,"Apr 17, 2026, 3:20 PM",17/04/2026 15:20
"Again! This deal is not tied, in any way, to Lebanon, but we will, MAKE LEBANON GREAT AGAIN!",2.06k,ReTruths,11.2k,Likes,"Apr 17, 2026, 3:27 PM",17/04/2026 15:27
"Thank you to Pakistan and its Great Prime Minister and Field Marshall, two fantastic people!!! President DONALD J. TRUMP",2.01k,ReTruths,11.4k,Likes,"Apr 17, 2026, 3:30 PM",17/04/2026 15:30
A GREAT AND BRILLIANT DAY FOR THE WORLD! DJT,2.84k,ReTruths,14.1k,Likes,"Apr 17, 2026, 3:33 PM",17/04/2026 15:33
Iran has agreed to never close the Strait of Hormuz again. It will no longer be used as a weapon against the World! President DONALD J. TRUMP,5.21k,ReTruths,25.7k,Likes,"Apr 17, 2026, 3:40 PM",17/04/2026 15:40
"The Failing New York Times, FAKE NEWS CNN, and others, just don’t know what to do. They are desperately looking for a reason to criticize President Donald J. Trump on the Iran situation, but just can’t find it. Why don’t they just say, at the right time, JOB WELL DONE, MR. PRESIDENT, and start to gain back their credibility???",2.48k,ReTruths,11.1k,Likes,"Apr 17, 2026, 3:58 PM",17/04/2026 15:58
"President Xi is very happy that the Strait of Hormuz is open and/or rapidly opening. Our meeting in China will be a special one and, potentially, Historic. I look forward to being with President Xi — Much will be accomplished! President DONALD J. TRUMP",3.46k,ReTruths,15.7k,Likes,"Apr 18, 2026, 3:25 AM",18/04/2026 03:25
"Has anybody looked at how badly the country of Spain is doing. Their financial numbers, despite contributing almost nothing to NATO and their military defense, are absolutely horrendous. Sad to watch!!!",8.66k,ReTruths,41.9k,Likes,"Apr 18, 2026, 1:14 PM",18/04/2026 13:14
"Whether people like Israel or not, they have proven to be a GREAT Ally of the United States of America. They are Courageous, Bold, Loyal, and Smart and, unlike others that have shown their true colors in a moment of conflict and stress, Israel fights hard, and knows how to WIN! President DJT",4.11k,ReTruths,16.7k,Likes,"Apr 19, 2026, 2:07 AM",19/04/2026 02:07
"Iran decided to fire bullets yesterday in the Strait of Hormuz — A Total Violation of our Ceasefire Agreement! Many of them were aimed at a French Ship, and a Freighter from the United Kingdom. That wasn’t nice, was it? My Representatives are going to Islamabad, Pakistan — They will be there tomorrow evening, for Negotiations. Iran recently announced that they were closing the Strait, which is strange, because our BLOCKADE has already closed it. They’re helping us without knowing, and they are the ones that lose with the closed passage, $500 Million Dollars a day! The United States loses nothing. In fact, many Ships are headed, right now, to the U.S., Texas, Louisiana, and Alaska, to load up, compliments of the IRGC, always wanting to be “the tough guy!” We’re offering a very fair and reasonable DEAL, and I hope they take it because, if they don’t, the United States is going to knock out every single Power Plant, and every single Bridge, in Iran. NO MORE MR. NICE GUY! They’ll come down fast, they’ll come down easy and, if they don’t take the DEAL, it will be my Honor to do what has to be done, which should have been done to Iran, by other Presidents, for the last 47 years. IT’S TIME FOR THE IRAN KILLING MACHINE TO END! President DONALD J. TRUMP",16.5k,ReTruths,71.7k,Likes,"Apr 19, 2026, 1:10 PM",19/04/2026 13:10
"Today, an Iranian-flagged cargo ship named TOUSKA, nearly 900 feet long and weighing almost as much as an aircraft carrier, tried to get past our Naval Blockade, and it did not go well for them. The U.S. Navy Guided Missile Destroyer USS SPRUANCE intercepted the TOUSKA in the Gulf of Oman, and gave them fair warning to stop. The Iranian crew refused to listen, so our Navy ship stopped them right in their tracks by blowing a hole in the engineroom. Right now, U.S. Marines have custody of the vessel. The TOUSKA is under U.S. Treasury Sanctions because of their prior history of illegal activity. We have full custody of the ship, and are seeing what’s on board! President DONALD J. TRUMP",8.09k,ReTruths,33.1k,Likes,"Apr 19, 2026, 8:23 PM",19/04/2026 20:23
"Israel never talked me into the war with Iran, the results of Oct. 7th, added to my lifelong opinion that IRAN CAN NEVER HAVE A NUCLEAR WEAPON, did. I watch and read the FAKE NEWS Pundits and Polls in total disbelief. 90% of what they say are lies and made up stories, and the polls are rigged, much as the 2020 Presidential Election was rigged. Just like the results in Venezuela, which the media doesn’t like talking about, the results in Iran will be amazing - And if Iran’s new leaders (Regime Change!) are smart, Iran can have a great and prosperous future! President DJT",601,ReTruths,2.33k,Likes,"Apr 20, 2026, 3:16 PM",20/04/2026 15:16
"The DEAL that we are making with Iran will be FAR BETTER than the JCPOA, commonly referred to as “The Iran Nuclear Deal,” penned by Barack Hussein Obama and Sleepy Joe Biden, one of the Worst Deals ever made having to do with the Security of our Country. It was a guaranteed Road to a Nuclear Weapon, which will not, and cannot, happen with the Deal we’re working on. They actually gave $1.7 Billion Dollars in “GREEN” Cash, loaded into a Boeing 757, and flown to Iran for Iranian leadership to spend anyway they saw fit. He emptied out all of the Cash from Banks in D.C., Virginia, and Maryland. Those Bankers said they’ve never seen anything like it before. In addition, Hundreds of Billions of Dollars was paid to Iran. If I did not terminate that “Deal,” Nuclear Weapons would have been used on Israel, and all over the Middle East, including our cherished U.S. Military Bases. The Fake News, like Lightweight Washington Post “Journalist” David Ignatius, loves to talk about the JCPOA, knowing that it was DANGEROUS, and a Complete Embarrassment to our Country. If a Deal happens under “TRUMP,” it will guarantee Peace, Security, and Safety, not only for Israel and the Middle East, but for Europe, America, and everywhere else. It will be something that the entire World will be proud of, instead of the years of Embarrassment and Humiliation that we have been forced to suffer due to incompetent and cowardly leadership! President DONALD J. TRUMP",6k,ReTruths,23.8k,Likes,"Apr 20, 2026, 6:35 PM",20/04/2026 18:35
"The Democrats are doing everything possible to hurt the very strong position we are in with respect to Iran. Despite World War I lasting 4 years, 3 months, and 14 days, World War II lasting 6 years and 1 day, the Korean War lasting 3 years, 1 month, and 2 days, the Vietnam War lasting 19 years, 5 months, and 29 days, and Iraq lasting 8 years, 8 months, and 28 days, they like to say that I promised 6 weeks to defeat Iran, and actually, from the Military standpoint, it was far faster than that, but I’m not going to let them rush the United States into making a Deal that is not as good as it could have been. I read the Fake News saying that I am under “pressure” to make a Deal. THIS IS NOT TRUE! I am under no pressure whatsoever, although, it will all happen, relatively quickly! Time is not my adversary, the only thing that matters is that we finally, after 47 years, straighten out the MESS that other Presidents let happen because they didn’t have the Courage or Foresight to do what had to be done with respect to Iran. We’re in it, and it will be done RIGHT, and we won’t let the Weak and Pathetic Democrats, TRAITORS ALL, who for years have been talking about the Dangers of Iran, and that something has to be done, but now, since I’m the one doing it, belittle the accomplishments of our Military and the Trump Administration. This is being perfectly executed, on the scale of Venezuela, just a bigger, more complex operation. The result will be the same. In my First Term, I built the Greatest Military our Country has ever seen, including adding Space Force. In my Second Term, I am properly and judiciously using our Military to solve problems left to us by others of far less understanding or competence. MAKE AMERICA GREAT AGAIN! President DONALD J. TRUMP",7.54k,ReTruths,29.7k,Likes,"Apr 20, 2026, 6:40 PM",20/04/2026 18:40
"I’m winning a War, BY A LOT, things are going very well, our Military has been amazing and, if you read the Fake News, like The Failing New York Times, the absolutely horrendous and disgusting Wall Street Journal, or the now almost defunct, fortunately, Washington Post, you would actually think we are losing the War. The enemy is confused, because they get these same Media “reports,” and yet they realize their Navy has been completely wiped out, their Air Force has gone onto darker runways, they have no Anti Missile or Anti Airplane Equipment, their former leaders are mostly gone (This has been, in addition to everything else, Regime Change!), and perhaps, most important of all, THE BLOCKADE, which we will not take off until there is a “DEAL,” is absolutely destroying Iran. They are losing $500 Million Dollars a day, an unsustainable number, even in the short run. The Anti-America Fake News Media is rooting for Iran to win, but it’s not going to happen, because I’m in charge! Just like these unpatriotic people used every ounce of their limited strength to fight me in the Election, they continue to do so with Iran. The result will be the same — It already is! President DONALD J. TRUMP",11.5k,ReTruths,51.5k,Likes,"Apr 20, 2026, 7:11 PM",20/04/2026 19:11
"The Iranian leadership has forced hundreds of Ships toward the United States, mostly Texas, Louisiana, and Alaska, to get their Oil — Thank you very much! President DONALD J. TRUMP",7.81k,ReTruths,36.7k,Likes,"Apr 20, 2026, 7:28 PM",20/04/2026 19:28
"Prime Minister Keir Starmer of the United Kingdom acknowledged that he “exercised wrong judgement” when he chose his Ambassador to Washington. I agree, he was a really bad pick. Plenty of time to recover, however! President DJT",4.59k,ReTruths,23k,Likes,"Apr 21, 2026, 4:04 AM",21/04/2026 04:04
"Operation Midnight Hammer was a complete and total obliteration of the Nuclear Dust sites in Iran. Therefore, digging it out will be a long and difficult process. Fake News CNN, and other corrupt Media Networks and Platforms, fail to give our great aviators the credit they deserve - Always trying to demean and belittle - LOSERS!!!",6.53k,ReTruths,29.3k,Likes,"Apr 21, 2026, 4:22 AM",21/04/2026 04:22
